{
  "trace_id": "550e8400-e29b-41d4-a716-446655440000",
  "parent_trace_id": null,
  "skill_mode": "delegate",
  "transport": "mcp",
  "request": {
    "task": "Find all places in src/ where subprocess.run is called inside an async function and produce a markdown table.",
    "context_refs": ["/home/nas/projects/farm/farmbrite-voice-agent/src/"],
    "context_digest": "sha256:abc123def456...",
    "required_output_format": "markdown table with columns: file:line, async_function_name, subprocess_args",
    "driver_position": "none",
    "constraints": ["read-only", "do not modify any files", "Python only"],
    "allowed_actions": ["sandbox: read-only", "tools: filesystem"],
    "out_of_scope": ["test files (tests/)", "vendor code", "anything outside src/"],
    "acceptance_criteria": [
      "every row references an async def",
      "every file:line resolves to a real subprocess.run call",
      "table is sorted by file path"
    ]
  },
  "execution": {
    "started_at": "2026-05-24T15:30:00Z",
    "ended_at": "2026-05-24T15:31:12Z",
    "elapsed_ms": 72000,
    "exit_status": "success",
    "error_type": "null",
    "model": "gpt-5.2-codex",
    "thread_id": "019e5a1f-e06f-7321-bbce-f0f0545ef637",
    "turn_count": 1,
    "tokens": {"input": 8432, "output": 412, "cached_input": 6201, "reasoning_output": 0},
    "tool_calls": 3
  },
  "response": {
    "artifact": "/tmp/codex-out.md",
    "artifact_kind": "markdown",
    "evidence": [
      {"kind": "file_line", "ref": "src/farmbrite_voice_agent/providers/llm.py:169", "note": "claude-code CLI provider"},
      {"kind": "file_line", "ref": "src/farmbrite_voice_agent/providers/llm.py:433", "note": "codex CLI provider"},
      {"kind": "command_output", "ref": "rg -n 'subprocess\\.run' src/", "note": "exhaustive scan, only 2 matches"}
    ],
    "assumptions": ["only Python files in src/ are in scope", "async context = the enclosing def is async def"],
    "known_gaps": [],
    "framing": {"status": "accepted", "reframed_question": null, "reason": null}
  },
  "verification": {
    "verifier": "driver",
    "checks": [
      {"name": "every cited file:line exists", "result": "passed", "evidence": "ran cat -n on each, all present"},
      {"name": "each call is inside async def", "result": "passed", "evidence": "verified enclosing def via ast walk"},
      {"name": "no false positives", "result": "passed", "evidence": "grep returned same 2 hits"}
    ],
    "result": "passed",
    "notes": "All claims verified against ground truth."
  },
  "handoff": {
    "integrated_by_driver": true,
    "driver_changes_made": ["added findings to the voice-agent review summary"],
    "worker_output_modified": false
  },
  "outcome": "accepted"
}
